{
  "version": 1,
  "type": "workflow",
  "title": "Qwen3-VL Training and Evaluation Workflow",
  "nodes": [
    {
      "id": "training-data",
      "label": "Training Data",
      "role": "data",
      "detail": "Curated image-caption, visual knowledge, and OCR data used for alignment.",
      "evidence": {
        "section": "Training Recipe",
        "page": 0,
        "quote": "We utilize a curated dataset of approximately 67B tokens, consisting of high-quality image-caption pairs, visual knowledge collections, and optical character recognition (OCR) data."
      }
    },
    {
      "id": "vision-encoder",
      "label": "Vision Encoder",
      "role": "module",
      "detail": "SigLIP-2 vision encoder trained with dynamic input resolutions.",
      "evidence": {
        "section": "Model Architecture",
        "page": 0,
        "quote": "We utilize the SigLIP-2 architecture as our vision encoder and continue training it with dynamic input resolutions"
      }
    },
    {
      "id": "vl-merger",
      "label": "VL Merger",
      "role": "module",
      "detail": "Two-layer MLP compresses visual features into visual tokens aligned with the LLM.",
      "evidence": {
        "section": "Model Architecture",
        "page": 0,
        "quote": "we use a two-layer MLP to compress visual features from the vision encoder into a single visual token, aligned with the LLM’s hidden dimension."
      }
    },
    {
      "id": "llm-backbone",
      "label": "LLM Backbone",
      "role": "module",
      "detail": "Qwen3 large language model backbone in the three-module architecture.",
      "evidence": {
        "section": "Model Architecture",
        "page": 0,
        "quote": "Qwen3-VL adopts a three-module architecture comprising a vision encoder, an MLP-based vision–language merger, and a large language model (LLM)."
      }
    },
    {
      "id": "interleaved-mrope",
      "label": "Interleaved MRoPE",
      "role": "module",
      "detail": "Positional encoding that interleaves temporal, horizontal, and vertical components.",
      "evidence": {
        "section": "Introduction",
        "page": 0,
        "quote": "We therefore adopt an interleaved MRoPE that distributes t, h, and w uniformly across low- and high-frequency bands"
      }
    },
    {
      "id": "deepstack",
      "label": "DeepStack",
      "role": "module",
      "detail": "Cross-layer fusion routing visual tokens to corresponding LLM layers.",
      "evidence": {
        "section": "Introduction",
        "page": 0,
        "quote": "we incorporate the pioneering DeepStack mechanism. Visual tokens from different layers of the vision encoder are routed to corresponding LLM layers via lightweight residual connections"
      }
    },
    {
      "id": "pretraining",
      "label": "Pretraining",
      "role": "module",
      "detail": "Four-phase pretraining pipeline from alignment to long-context adaptation.",
      "evidence": {
        "section": "Introduction",
        "page": 0,
        "quote": "Our training pipeline consists of two stages: pretraining and post-training. Pretraining proceeds in four phases:"
      }
    },
    {
      "id": "post-training",
      "label": "Post-Training",
      "role": "module",
      "detail": "Three-phase post-training with SFT, distillation, and reinforcement learning.",
      "evidence": {
        "section": "Introduction",
        "page": 0,
        "quote": "Post-training comprises three phases: (i) supervised fine-tuning on long chain-of-thought data, (ii) knowledge distillation from stronger teacher models, and (iii) reinforcement learning."
      }
    },
    {
      "id": "qwen3-vl",
      "label": "Qwen3-VL",
      "role": "model",
      "detail": "Dense and MoE vision-language model family built on Qwen3 backbones.",
      "evidence": {
        "section": "Model Architecture",
        "page": 0,
        "quote": "Qwen3-VL is instantiated in three dense variants (Qwen3-VL-2B/4B/8B/32B) and two MoE variants (Qwen3-VL-30B-A3B, Qwen3-VL-235B-A22B), all built upon Qwen3 backbones."
      }
    },
    {
      "id": "evaluation",
      "label": "Evaluation",
      "role": "eval",
      "detail": "Multimodal reasoning benchmark evaluation of the Qwen3-VL series.",
      "evidence": {
        "section": "Multimodal Reasoning",
        "page": 0,
        "quote": "We evaluate the Qwen3-VL series on a wide range of multimodal reasoning benchmarks"
      }
    }
  ],
  "edges": [
    {
      "from": "training-data",
      "to": "pretraining",
      "label": "trains on",
      "evidence": {
        "section": "Training Recipe",
        "page": 0,
        "quote": "The model is trained on a massive and diverse dataset of approximately 1 trillion (1T) tokens."
      }
    },
    {
      "from": "vision-encoder",
      "to": "vl-merger",
      "label": "visual features compressed by",
      "evidence": {
        "section": "Model Architecture",
        "page": 0,
        "quote": "we use a two-layer MLP to compress visual features from the vision encoder into a single visual token"
      }
    },
    {
      "from": "vl-merger",
      "to": "llm-backbone",
      "label": "aligned to hidden dimension",
      "evidence": {
        "section": "Model Architecture",
        "page": 0,
        "quote": "aligned with the LLM’s hidden dimension."
      }
    },
    {
      "from": "interleaved-mrope",
      "to": "qwen3-vl",
      "label": "positional encoding",
      "evidence": {
        "section": "Introduction",
        "page": 0,
        "quote": "We therefore adopt an interleaved MRoPE that distributes t, h, and w uniformly across low- and high-frequency bands"
      }
    },
    {
      "from": "deepstack",
      "to": "qwen3-vl",
      "label": "cross-layer fusion",
      "evidence": {
        "section": "Introduction",
        "page": 0,
        "quote": "we incorporate the pioneering DeepStack mechanism. Visual tokens from different layers of the vision encoder are routed to corresponding LLM layers via lightweight residual connections"
      }
    },
    {
      "from": "pretraining",
      "to": "post-training",
      "label": "followed by",
      "evidence": {
        "section": "Introduction",
        "page": 0,
        "quote": "Our training pipeline consists of two stages: pretraining and post-training."
      }
    },
    {
      "from": "post-training",
      "to": "qwen3-vl",
      "label": "refines",
      "evidence": {
        "section": "Training Recipe",
        "page": 0,
        "quote": "Our post-training pipeline is a three-stage process designed to refine the model's instruction-following capabilities, bolster its reasoning abilities, and align it with human preferences."
      }
    },
    {
      "from": "llm-backbone",
      "to": "qwen3-vl",
      "label": "backbone",
      "evidence": {
        "section": "Model Architecture",
        "page": 0,
        "quote": "all built upon Qwen3 backbones."
      }
    },
    {
      "from": "qwen3-vl",
      "to": "evaluation",
      "label": "evaluated on",
      "evidence": {
        "section": "Multimodal Reasoning",
        "page": 0,
        "quote": "We evaluate the Qwen3-VL series on a wide range of multimodal reasoning benchmarks"
      }
    }
  ],
  "groups": []
}
